<?xml version='1.0' encoding='UTF-8'?>
<!ELEMENT helpindex (node|page)*>
<!ELEMENT node (page|title)*>
<!ELEMENT page (title|url)*>
<!ELEMENT url (#PCDATA)>
<!ELEMENT title (#PCDATA)>
